Ticker,Date,Headline,Article,Type
COKE,11272018,Plunge in Thomas Cook  weak miners dent British stocks ,* Greggs hits record high after strong sales  ups profit outlook,normal
COKE,05082018,BRIEF-Coca-Cola Bottling Co. Consolidated Reports Q1 Loss Per Share $1.52 ,* COCA-COLA BOTTLING CO. CONSOLIDATED REPORTS FIRST QUARTER 2018 RESULTS,topStory
COKE,03262018,BRIEF-Coca-Cola Bottling Co Consolidated's CEO FY 2017 Total Compensation Was $11.1 Mln ,* COCA-COLA BOTTLING CO CONSOLIDATED SAYS CEO J. FRANK HARRISON III'S FY 2017 TOTAL COMPENSATION WAS $11.1 MILLION VERSUS $11.4 MILLION IN FY 2016 - SEC FILING Source text (https://bit.ly/2pF72Nm) Further company coverage:,topStory
COKE,02272018,BRIEF-Coca‑Cola Bottling Co Reports Q4 Non-GAAP EPS $0.20 ,* COCA-COLA BOTTLING CO. CONSOLIDATED REPORTS FOURTH QUARTER 2017 AND FISCAL 2017 RESULTS,topStory
COKE,08082017,BRIEF-Coca-Cola Bottling Co Consolidated Q2 non-GAAP earnings per share $2.36 ,* Coca-Cola Bottling Co Consolidated reports second quarter 2017 results,topStory
COKE,07212017,BRIEF-Coca-Cola Bottling Co Consolidated sets quarterly dividend of $0.25shr ,* Sets quarterly dividend of $0.25per share Source text for Eikon: Further company coverage:,topStory
COKE,05092017,BRIEF-Coca‑Cola Bottling Co. Consolidated reports Q1 2017 results ,* Coca Cola Bottling Co. Consolidated reports first quarter 2017 results,topStory
COKE,05022017,BRIEF-Coca Cola Bottling amends final beverage agreement ,* Coca Cola Bottling - in relation with closing under distribution APA Co  units entered into amendment to final beverage agreement dated march 31  2017 Source text for Eikon: Further company coverage: (Reporting by Prithvi Kanti Bandyopadhyay),topStory
COKE,04132017,BRIEF-Coca-Cola Bottling Co Consolidated signs agreements to expand distribution territory and purchase manufacturing facility ,* Coca-Cola Bottling Co. Consolidated signs definitive agreements  to expand distribution territory and purchase manufacturing facility,topStory
COKE,04122017,BRIEF-Coca Cola Bottling Co Consolidated and Coca-Cola Company enters into a non-binding letter of intent ,* Coca Cola Bottling Co Consolidated - on April 11  2017  co and Coca-Cola Company enters into a non-binding letter of intent  the ' Somerset LOI ',topStory
COKE,03202017,BRIEF-Coca Cola Bottling Co Consolidated CEO Frank Harrison III's 2016 total compensation was $11.4 mln ,* CEO Frank Harrison III's 2016 total compensation was $11.4 million versus $8.2 million in 2015 - SEC filing,topStory
COKE,03102017,BRIEF-Coca Cola Bottling Co Consolidated - CEO's 2016 total compensation was $11.3 mln vs. $8.2 mln ,* Coca Cola Bottling Co consolidated - CEO J. Frank Harrison's 2016 total compensation was $11.3 million versus $8.2 million - sec filing  Source text (http://bit.ly/2muXLr7) Further company coverage:,topStory
COKE,03082017,BRIEF-Coca‑Cola Bottling Q4 earnings per share $2.31 ,* Coca-Cola Bottling Co consolidated reports fourth quarter 2016 and fiscal 2016 results,topStory
COKE,02102017,BRIEF-Vanguard Group reports a 5.15 percent passive stake in Coca Cola Bottling Co Consolidated as of December 31  2016 ,* Vanguard Group Inc reports a 5.15 percent passive stake in Coca Cola Bottling Co Consolidated as of December 31  2016 -SEC filing  Source text for Eikon: [ID:http://bit.ly/2kbiy3b] Further company coverage:,topStory
COKE,01272017,BRIEF-Coca Cola Bottling  Coca-Cola unit entered into amendment to APA ,* Coca Cola Bottling Co Consolidated- co  unit of Coca-Cola Co  entered into amendment to asset purchase agreement dated September 1  2016 - SEC filing,topStory
COKE,11172016,Swire Pacific in talks to buy Coca-Cola bottling assets in China: Bloomberg ,Hong Kong conglomerate Swire Pacific Ltd  is in talks to buy Coca-Cola Co's  bottling assets in China from Cofco Corp's [CNCOF.UL] China Foods Ltd  unit  Bloomberg reported.,topStory
COKE,11172016,Swire Pacific in talks to buy Coca-Cola bottling assets in China - Bloomberg ,Nov 17 Hong Kong conglomerate Swire Pacific Ltd  is in talks to buy Coca-Cola Co's bottling assets in China from Cofco Corp's China Foods Ltd  unit  Bloomberg reported.,normal
COKE,10262016,UPDATE 1-Kirin  Japan Coca-Cola bottlers talk distribution deal  capital tie-up ,* Kirin says in talks for cooperation in distribution  procurement,topStory
COKE,10262016,CORRECTED-Japan's Coca-Cola  Kirin plan tie-up to cut costs - Nikkei ,Oct 26 The Coca-Cola group in Japan and brewer Kirin Holdings Co Ltd are near a deal for an operational and capital partnership amid intense price competition in the Japanese soft-drink market  the Nikkei reported.,normal
COKE,10262016,Kirin  Japan's Coca-Cola bottlers discussing possible capital tie-up ,TOKYO  Oct 26 Japanese beverage company Kirin Holdings said it is in talks with Japan's two Coca-Cola bottling companies  Coca-Cola East Japan and Coca-Cola West  about a possible capital tie-up.,normal
COKE,10142016,BRIEF-Coca Cola Bottling Co Consolidated sets quarterly dividend of $0.25/share ,* Sets quarterly dividend of $0.25 per share  Source text for Eikon:  Further company coverage:,topStory
COKE,08092016,BRIEF-Coca Cola Bottling qtrly sales $840.4 mln vs $614.7 mln ,* Coca cola bottling co consolidated qtrly consolidated basic net income per share $1.68,topStory
COKE,07152016,BRIEF-Coca Cola Bottling Co sets quarterly dividend of $0.25 per share ,* Sets quarterly dividend of $0.25 per share  Source text for Eikon:  Further company coverage:    (Bengaluru Newsroom; +1 646 223 8780),topStory
COKE,07052016,BRIEF-Coca Cola Bottling Co Consolidated  Coca-Cola Co and Coca-Cola Refreshments USA enter into an agreement ,* On June 29  Co  Coca-Cola Company and Coca-Cola Refreshments USA Inc entered into an agreement - SEC filing,topStory
COKE,06092016,BRIEF-Coca Cola Bottling entered term loan agreement with JPMorgan Chase Bank - SEC filing ,* On June 7  2016  co entered into term loan agreement with JPMorgan Chase Bank - SEC filing,topStory
COKE,05252016,Mexico's Arca signs letter of intent with Coca-Cola bottling franchise in U.S. ,MEXICO CITY Mexican bottling company Arca Continental  said on Wednesday it had signed a letter of intent with the Coca-Cola Company and Coca-Cola Bottling Company UNITED to operate the Coca-Cola franchise in parts of the United States.,topStory
COKE,05252016,Mexico's Arca signs letter of intent with Coca-Cola bottling franchise in U.S. ,MEXICO CITY  May 25 Mexican bottling company Arca Continental said on Wednesday it had signed a letter of intent with the Coca-Cola Company and Coca-Cola Bottling Company UNITED to operate the Coca-Cola franchise in parts of the United States.    (Reporting by Gabriela Lopez; Editing by Sandra Maler),normal
COKE,05102016,BRIEF-Coca Cola Bottling Co consolidated Q1 non-gaap earnings per share $0.67 ,* Cola bottling co. Consolidated reports first quarter 2016 results,topStory
COKE,04152016,BRIEF-Coca Cola Bottling Co Consolidated sets qtrly dividend of $0.25/shr ,* Sets quarterly dividend of $0.25 per share  Source text for Eikon:  Further company coverage:,topStory
COKE,04142016,BRIEF-S&P - Coca-Cola Bottling Co Consolidated ratings affirmed on additional territory expansion ,* Coca-Cola Bottling Co Consolidated ratings affirmed on additional territory expansion; outlook stable,topStory
COKE,04082016,BRIEF-Coca Cola Bottling Co says it entered into a master services agreement with Cona Services ,* Co entered into a master services agreement with cona services llc - sec filing,topStory
COKE,04082016,BRIEF-Coca Cola Bottling and Coca-Cola Company entered into 2016 incidence pricing letter agreement ,* On april 6  2016  co  coca-cola company entered into 2016 incidence pricing letter agreement - sec filing,normal
COKE,03302016,BRIEF-Coca Cola Bottling Co Consolidated CEO J. Frank Harrison III's 2015 compensation $8.2 mln - SEC filing ,* CEO J. Frank Harrison  III's 2015 total compensation was $8.2 million versus $7.7 million in 2014 - SEC filing,topStory
