Ticker,Date,Headline,Article,Type
TSLA,06112016,Tesla to clarify how customers may disclose problems ,WASHINGTON Tesla Motors Inc on Friday revised a nondisclosure clause in its customer repair agreements after a U.S. regulator took issue with the practice  while the electric carmaker's chief executive separately called most customer reports of suspension problems in its Model S sedan fraudulent.,topStory
TSLA,06112016,UPDATE 2-Tesla to clarify how customers may disclose problems ,WASHINGTON  June 10 Tesla Motors Inc on Friday revised a nondisclosure clause in its customer repair agreements after a U.S. regulator took issue with the practice  while the electric carmaker's chief executive separately called most customer reports of suspension problems in its Model S sedan fraudulent.,normal
TSLA,06102016,Tesla to clarify how customers may disclose problems -U.S. agency ,WASHINGTON Tesla Motors Inc has agreed to revise its customer repair agreements to allow owners to report potential safety issues to U.S. auto safety regulators  a government spokesman said on Friday.,topStory
TSLA,06102016,Tesla will clarify customers may disclose vehicle problems -source ,WASHINGTON  June 10 Tesla Motors Inc  has agreed to revise its customer repair agreements to allow owners to report potential safety issues to U.S. auto safety regulators  a source briefed on the matter said.,normal
TSLA,06092016,U.S. reviewing suspension complaints in Tesla Model S cars ,WASHINGTON A federal regulator said on Thursday it is reviewing reports of suspension problems in Tesla Motors Inc's  Model S sedans  and is investigating whether the company urged customers to sign agreements not to disclose the problem. | Video ,topStory
TSLA,06092016,UPDATE 2-U.S. reviewing suspension complaints in Tesla Model S cars ,WASHINGTON  June 9 A federal regulator said on Thursday it is reviewing reports of suspension problems in Tesla Motors Inc's Model S sedans  and is investigating whether the company urged customers to sign agreements not to disclose the problem.,normal
TSLA,06092016,U.S. reviewing suspension complaints in Tesla Model S cars ,WASHINGTON  June 9 U.S. auto safety investigators are reviewing reports of suspension problems in Tesla Motors Inc Model S cars  a government spokesman said on Thursday.,normal
TSLA,06092016,Tesla Motors introduces two less costly Model S versions ,Electric carmaker Tesla Motors Inc  said on Thursday it would offer two slightly lower-priced versions of its electric Model S sedan  starting at $66 000 in the U.S. market.,normal
TSLA,06092016,UPDATE 1-Tesla Motors introduces two less costly Model S versions ,June 9 Electric carmaker Tesla Motors Inc  said on Thursday it would offer two slightly lower-priced versions of its electric Model S sedan  starting at $66 000 in the U.S. market.,normal
TSLA,06092016,Tesla Motors introduces two less-costly Model S versions ,June 9 Tesla Motors Inc said on Thursday it would offer two less-costly versions of its electric Model S sedan  starting at $66 000 in the U.S. market.,normal
TSLA,06092016,BRIEF-Tesla introduces two new variants of Model S sedan ,* Introducing two new variants of Model S  the Model S 60 And 60D,normal
TSLA,06092016,Tesla CEO says may source Samsung battery for energy storage products ,SEOUL Tesla Motors Inc may source batteries from Samsung SDI Co Ltd for its energy systems in homes  companies and utilities  rather than for its electric cars  the U.S. company's chief executive said on Wednesday.,normal
TSLA,06092016,UPDATE 1-Tesla CEO says may source Samsung battery for energy storage products ,* Samsung SDI shares rebound on Thursday after Musk's tweet   (Recasts first paragraph with Tesla CEO's latest tweet on non-car batteries),normal
TSLA,06082016,Tesla CEO says working exclusively with Panasonic for Model 3 battery ,SEOUL  June 8 Tesla Motors is working exclusively with Panasonic Corp to supply batteries for the Model 3  its first mass-market car  the U.S. automaker's chief executive said on Wednesday  sending Panasonic shares higher.,topStory
TSLA,06082016,Top U.S. auto regulator: Nimble rules needed for self-driving cars ,June 8 The top U.S. vehicle safety regulator said on Wednesday the government needs to be more nimble in designing rules for self-driving vehicles.,normal
TSLA,06082016,BRIEF-Tesla's Musk says "Tesla is working exclusively with Panasonic for Model 3 cells"- tweet ,* Tesla's Musk says "Tesla is working exclusively with Panasonic for Model 3 cells"- tweet,normal
TSLA,06072016,Samsung SDI making progress in talks with Tesla to supply batteries: source ,SEOUL Samsung SDI is making progress in talks with Tesla Motors to supply batteries for the U.S. automaker's Model 3 electric car as well as its energy storage products  a source with direct knowledge of the matter told Reuters.,topStory
TSLA,06072016,UPDATE 1-Samsung SDI making progress in talks with Tesla to supply batteries -source ,* SDI to be supplier if Tesla sales beat expectations -source   (Adds share reaction and comments from source),normal
TSLA,06072016,Samsung SDI making progress in talks with Tesla to supply batteries -source ,SEOUL  June 7 Samsung SDI is making progress in talks with Tesla Motors to supply batteries for the U.S. automaker's Model 3 electric car as well as its energy storage products  a source with direct knowledge of the matter told Reuters.,normal
TSLA,05312016,BRIEF-Tesla CEO says has faced bigger challenges than Model 3 ramp ,* Tesla CEO Elon Musk told shareholders the company had made "bigger leaps" in the past than ramping up its production now for Model 3 demand. Musk spoke during the company's 2016 annual shareholder meeting in Mountain View  California.  Further company coverage:    (Reporting by Alexandria Sage),topStory
TSLA,05242016,South Korea's Mando in talks to supply parts for Tesla's Model 3: source ,SEOUL Mando Corp  is in talks with Tesla Motors  to supply parts for its Model 3 car  an industry source said  as it seeks to join other South Korean firms supplying components for Tesla's more affordable electric cars.,topStory
TSLA,05242016,S.Korea's Mando in talks to supply parts for Tesla's Model 3 - source ,SEOUL  May 24 Mando Corp is in talks with Tesla Motors to supply parts for its Model 3 car  a person with direct knowledge of the matter said  seeking to join other South Korean firms supplying components for Tesla's more affordable electric cars.,normal
TSLA,05202016,Exclusive: Suppliers question Tesla's goals for Model 3 output ,DETROIT/SAN FRANCISCO Tesla Motors Inc has surprised parts makers with plans to move up the launch of high-volume production of its Model 3 to 2018  two years earlier than planned - an acceleration that supplier executives and industry consultants said would be difficult to achieve and potentially costly.,topStory
TSLA,05202016,Panasonic can speed up Tesla plant investment if needed ,TOKYO Japan's Panasonic Corp is ready to bring forward its investment in a Tesla battery plant it is helping establish if this is required to meet demand for the electric car maker's upcoming Model 3 sedan.,normal
TSLA,05202016,UPDATE 2-Panasonic can speed up Tesla plant investment if needed ,* Possible M&A deals on the table -Panasonic exec   (Adds more comments on M&A deals),normal
TSLA,05202016,Panasonic: can move up investment for Tesla battery plant if asked ,TOKYO  May 20 Panasonic Corp is prepared to move up its investment plans for Tesla Motors Inc's  battery plant if needed to meet strong demand for the electric car maker's upcoming Model 3 sedan  an executive at the Japanese electronics group said.,normal
TSLA,05202016,Reuters Business News Schedule at 0430 GMT/00.30AM ET ,BEIJING - China's cabinet appoints a former International Monetary Fund (IMF) official as a new deputy governor of the central bank  the latest appointment following recent upheavals in the country's currency and financial markets. (CHINA-GOVERNMENT/APPOINTMENT (UPDATE 1)  moved  360 words),normal
TSLA,05182016,Tesla plans to sell $1.7 billion in new stock to fund Model 3 ,DETROIT/SAN FRANCISCO Tesla Motors Inc  will offer up to $1.7 billion of new common stock to finance the accelerated launch of its new Model 3 electric sedan  the electric luxury car maker said on Wednesday.,topStory
TSLA,05182016,UPDATE 2-Tesla plans to sell $1.7 bln in new stock to fund Model 3 ,DETROIT/SAN FRANCISCO  May 18 Tesla Motors Inc  will offer up to $1.7 billion of new common stock to finance the accelerated launch of its new Model 3 electric sedan  the electric luxury car maker said on Wednesday.,normal
TSLA,05182016,Tesla plans $2 billion stock offering to finance quicker Model 3 launch ,May 18 Tesla Motors Inc said it would sell $2 billion of stock to help finance the accelerated launch of its new Model 3 electric sedan.,normal
TSLA,05182016,Tesla Motors plans to raise $2 bln for Model 3 ,May 18 Tesla Motors Inc said it expected to raise about $2 billion through a stock offering to "accelerate the ramp" of its first mass-market car  the Model 3.,normal
TSLA,05182016,BRIEF-Tesla raising money to accelerate ramp of Model 3 via $2 bln offering ,* Announced an underwritten registered public offering of about $2 billion of common stock,normal
TSLA,05162016,BRIEF-Tesla Motors responds to Mercury news article ,* Tesla motors Inc says with respect to person at center of article in the Mercury news  tesla's "standards were not met",topStory
TSLA,05142016,Tesla taps Audi executive as vice president of vehicle production ,Tesla Motors Inc  said on Friday it hired Volkswagen  executive Peter Hochholdinger as its vice president of vehicle production.,topStory
TSLA,05142016,Tesla taps Audi executive as vice president of vehicle production ,May 13 Tesla Motors Inc said on Friday it hired Volkswagen executive Peter Hochholdinger as its vice president of vehicle production.,normal
TSLA,05112016,Tesla says it has not finalized 2017 Model 3 design ,SAN FRANCISCO/DETROIT Tesla Motors Inc  said on Tuesday the design of its new Model 3 has not been finalized  even though the electric car maker expects to begin building the mass-market sedan within the next 18 months.,topStory
TSLA,05112016,Tesla says it has not finalized 2017 Model 3 design ,SAN FRANCISCO/DETROIT  May 10 Tesla Motors Inc  said on Tuesday the design of its new Model 3 has not been finalized  even though the electric car maker expects to begin building the mass-market sedan within the next 18 months.,normal
TSLA,05102016,BRIEF-Tesla expects operating expense up 20-25 percent in 2016 - 10Q ,May 10 Tesla Motors Inc estimates operating expenses to grow 20-25 percent in 2016 from 2015 - 10-Q filing Further company coverage:    (Reporting by Alexandria Sage),topStory
TSLA,05052016,Tesla puts pedal to the metal  500 000 cars planned in 2018 ,Tesla Motors Inc  said it was stepping up production plans for its upcoming Model 3 mass-market sedan and would build a total of 500 000 all-electric vehicles in 2018  two years ahead of schedule  but warned that spending will ramp up in tandem. | Video ,topStory
TSLA,05042016,BRIEF-Tesla Motors Inc Q1 NON-GAAP net loss $0.57 per share ,* Volume model 3 production and deliveries to start in late 2017,topStory
TSLA,05042016,Two Tesla executives leaving ahead of Model 3 ramp-up ,SAN FRANCISCO Two top manufacturing executives are leaving Tesla Motors Inc  as the Silicon Valley electric-car maker prepares to launch its first mass-market car  the Model 3  and sharply ramp up production.,normal
TSLA,05032016,Wall Street values Tesla Motors at $620 000 per car ,SAN FRANCISCO Company founder and CEO Elon Musk may not mention Tesla Motors Inc's  stock price when his electric car company gives its latest financial update on Wednesday  but it will be front and center for investors divided over its seemingly rich valuation.,topStory
TSLA,04252016,Taking on Tesla: China's Jia Yueting aims to outmuscle Musk ,BEIJING/DETROIT Tomorrow's cars will be all-electric  self-driving  connected to high-speed communications networks ... and free.,topStory
TSLA,04242016,INSIGHT-Taking on Tesla: China's Jia Yueting aims to outmuscle Musk ,BEIJING/DETROIT  April 25 Tomorrow's cars will be all-electric  self-driving  connected to high-speed communications networks ... and free.,topStory
TSLA,04212016,Tesla CEO Musk: almost 400 000 orders received for new Model 3 ,OSLO Electric car manufacturer Tesla Motors  has received almost 400 000 orders for its latest car  the model 3 sedan   its CEO said on Thursday.,topStory
TSLA,04212016,Tesla CEO Musk: almost 400 000 orders received for new Model 3 ,OSLO  April 21 Electric car manufacturer Tesla Motors has received almost 400 000 orders for its latest car  the model 3 sedan   its CEO said on Thursday.,normal
TSLA,04152016,Fiat Chrysler CEO says can build Tesla Model 3 rival if makes business sense ,AMSTERDAM Fiat Chrysler Automobiles (FCA)  could build an Italian-style rival to Tesla's Model 3 within 12 months if the electric carmaker can prove the vehicle makes business sense  FCA Chief Executive Sergio Marchionne said on Friday.,topStory
TSLA,04152016,Fiat Chrysler CEO says can build Tesla Model 3 rival if makes business sense ,AMSTERDAM  April 15 Fiat Chrysler Automobiles (FCA) could build an Italian-style rival to Tesla's Model 3 within 12 months if the electric carmaker can prove the vehicle makes business sense  FCA Chief Executive Sergio Marchionne said on Friday.,normal
TSLA,04112016,Tesla to recall 2 700 Model X SUVs over seat issue ,SAN FRANCISCO Tesla Motors Inc  will recall 2 700 Model X sport utility vehicles in the United States due to a faulty locking hinge in the third-row seats that increases the risk the seats could fall forward in a crash  the electric car maker said on Monday.,topStory
TSLA,04112016,UPDATE 1-Tesla to recall 2 700 Model X SUVs over seat issue ,SAN FRANCISCO  April 11 Tesla Motors Inc  will recall 2 700 Model X sport utility vehicles in the United States due to a faulty locking hinge in the third-row seats that increases the risk the seats could fall forward in a crash  the electric car maker said on Monday.,normal
TSLA,04112016,Tesla to voluntarily recall 2 700 Model X SUVs over seat issue ,SAN FRANCISCO  April 11 Tesla Motors Inc  said on Monday it was issuing a voluntary recall of 2 700 Model X sport utility vehicles in the United States due to a faulty locking hinge in the third-row seats that increases the risk the seats could fall forward in a crash.,normal
TSLA,04042016,Tesla says parts shortages hampered first-quarter sales ,DETROIT  April 4 Tesla Motors Inc said on Monday that parts shortages hampered vehicle production and sales in the first quarter  but the electric car maker still plans to build 80 000 to 90 000 vehicles this year.,topStory
TSLA,04042016,BRIEF-Tesla delivers 14 820 vehicles in Q1 2016 ,* Delivers 14 820 vehicles in Q1 2016 on track for full-year delivery guidance,normal
TSLA,04012016,Tesla  buoyed by strong Model 3 orders  may need more cash ,An initial flurry of orders has put Tesla Motors' new Model 3 sedan off to a fast start  but the company may need to raise more cash if it hopes to deliver the new electric vehicle to customers on time  analysts said on Friday. | Video ,topStory
TSLA,04012016,Tesla shares surge as Model 3 orders speed past estimates ,BENGALURU/DETROIT Shares of Tesla Motors Inc surged to their highest in six months early on Friday after the electric car maker said orders for its new Model 3 sedan  its first car aimed at the mass market  had sped past 130 000 in the first 24 hours.,normal
TSLA,04012016,US STOCKS-Wall St set for lower open after March payrolls data ,* Futures down: Dow 55 pts  S&P 7.5 pts  Nasdaq 16.5 pts   (Adds details  updates prices),normal
TSLA,04012016,LG Display to supply car displays for Tesla Model 3: source ,SEOUL LG Display will supply information displays for Tesla Motors' new Model 3 sedans  a person with direct knowledge of the matter said  grabbing a key contract for center consoles from another supplier.,normal
TSLA,04012016,LG Display to supply car displays for Tesla Model 3 - source ,SEOUL  April 1 LG Display will supply information displays for Tesla Motors' new Model 3 sedans  a person with direct knowledge of the matter said  grabbing a key contract for centre consoles from another supplier.,normal
TSLA,04012016,RPT-Tesla unveils $35 000-Model 3 with range of 215 miles ,HAWTHORNE  Calif.  March 31 Tesla Motors  gave a sneak preview Thursday of its Model 3 sedan  saying more than 130 000 people had ordered the car  even though it is more than a year away from production.,normal
TSLA,04012016,Tesla unveils $35 000-Model 3 with range of 215 miles ,HAWTHORNE  Calif.  March 31 Tesla Motors  gave a sneak preview Thursday of its Model 3 sedan  saying more than 130 000 people had ordered the car  even though it is more than a year away from production.,normal
TSLA,04012016,Tesla Model 3 to go into production in 2017: CEO Musk ,HAWTHORNE  California Tesla Motors  gave a sneak preview Thursday of its $35 000 electric car that is critical to the Silicon Valley auto maker's growth plans and soaring stock value.,normal
TSLA,04012016,Tesla Model 3 to go into production in 2017 -CEO Musk ,HAWTHORNE  California  March 31 Tesla Motors  gave a sneak preview Thursday of its $35 000 electric car that is critical to the Silicon Valley auto maker's growth plans and soaring stock value.,normal
TSLA,04012016,Tesla fans camp out  form long lines to sign up for new Model 3 ,LA JOLLA  Calif. Fans of luxury electric car maker Tesla Motors Inc  camped out overnight and stood in long lines to put down deposits on its new more affordable model  due to be unveiled at an event on Thursday evening.,normal
TSLA,03312016,Tesla fans line up  camp out to sign up for new Model 3 ,LA JOLLA  Calif.  March 31 Fans of luxury electric car maker Tesla Motors Inc camped out overnight and stood in lines to put down deposits on its new more affordable model  due to be unveiled at an event on Thursday evening.,topStory
TSLA,03142016,Early March gains in auto sector shares may prove fleeting ,NEW YORK  March 14 Auto stocks have come roaring out of the gate in the last month  but the gains may be short-lived as analysts and investors show signs of souring on the sector.,normal
Ticker,Date,Headline,Article,Type
TSLA,12072018,Tesla hires Washington trial lawyer as new general counsel ,Tesla Inc has hired Dane Butswinkas  a Washington  D.C. trial lawyer  as its general counsel  the electric car manufacturer said late on Thursday.,topStory
TSLA,12072018,Tesla hires Washington trial lawyer as new general counsel ,Dec 7 Tesla Inc has hired Dane Butswinkas  a Washington  D.C. trial lawyer  as its general counsel  the electric car manufacturer said late on Thursday.,normal
TSLA,12062018,Tesla plans to use stock-cash mix to pay off March debt: Bloomberg ,Tesla Inc will pay a 50-50 mix of stock and cash to holders of its bonds due in March  if they elect to convert the debt  Bloomberg reported on Thursday  citing a copy of the settlement notice.,topStory
TSLA,12062018,Tesla plans to use stock-cash mix to pay off March debt -Bbg ,Dec 6 Tesla Inc will pay a 50-50 mix of stock and cash to holders of its bonds due in March  if they elect to convert the debt  Bloomberg reported https://www.bloomberg.com/news/articles/2018-12-06/tesla-is-said-to-plan-using-stock-cash-mix-to-pay-off-march-debt on Thursday  citing a copy of the settlement notice.,normal
TSLA,12062018,Exclusive: Tesla  smarting from trade war  seeks bids for China Gigafactory construction ,SHANGHAI Tesla Inc has opened a tender process to build its Shanghai Gigafactory and at least one contractor has started buying materials  according to sources and documents reviewed by Reuters  the clearest indication that construction is imminent.,normal
TSLA,12042018,Tesla changes plans to start Model Y production: Business Insider ,Tesla Inc had plans to build its pilot small electric SUV Model Y at Gigafactory 1 by June 1  2020  the Business Insider reported on Monday  citing leaked internal documents  but said the company changed its plans later.,topStory
TSLA,12042018,Tesla changes plans to start Model Y production - Business Insider ,Dec 3 Tesla Inc had plans to build its pilot small electric SUV Model Y at Gigafactory 1 by June 1  2020  the Business Insider reported on Monday  citing leaked internal documents  but said the company changed its plans later.,normal
TSLA,12032018,UPDATE 3-Trump tweets China to cut tax on U.S.-made cars  revs up auto stocks ,* Move could boost BMW  Tesla  Mercedes-Benz imports (Adds China car dealer association comment  share price reactions  bullets),topStory
TSLA,11302018,Tesla achieves Model 3 production of 1 000 cars per day: Electrek ,Tesla Inc met its production target of 1 000 Model 3 cars per day  automotive news website Electrek reported on Friday  citing Chief Executive Officer Elon Musk's email to employees.,topStory
TSLA,11302018,Tesla achieves Model 3 production of 1 000 cars per day- Electrek ,Nov 30 Tesla Inc met its production target of 1 000 Model 3 cars per day  automotive news website Electrek reported on Friday  citing Chief Executive Officer Elon Musk's email to employees.,normal
TSLA,11302018,Nio  China rival to Tesla  says U.S. head to step down ,SHANGHAI The U.S. head of Nio Inc   an electric carmaker seen as one of the main Chinese rivals to Tesla Inc   will leave the company  the firm said in a filing on Friday  the first major management departure since its September IPO.,normal
TSLA,11302018,Nio  China rival to Tesla  says U.S. head to step down ,SHANGHAI  Nov 30 The U.S. head of Nio Inc   an electric carmaker seen as one of the main Chinese rivals to Tesla Inc  will leave the company  the firm said in a filing on Friday  the first major management departure since its September IPO.,normal
TSLA,11292018,Volkswagen planning new North America factory for electric vehicles ,LOS ANGELES  Nov 28 Volkswagen is deciding where to locate a new factory in North America to build electric vehicles for the U.S. market  the German automaker's new head for the Americas said on Wednesday.,normal
TSLA,11282018,Factbox: Tesla executive departures since 2016 ,Electric carmaker Tesla Inc has seen a flurry of senior executives leave the company in recent months.,topStory
TSLA,11282018,Trump threatens to cut GM subsidies in retaliation for U.S. job cuts ,WASHINGTON U.S. President Donald Trump threatened on Tuesday to eliminate subsidies for General Motors Co in retaliation for the automaker cutting U.S. jobs and plants  and the automaker also took fire from Canadian political and labor leaders for cutbacks there. | Video ,normal
TSLA,11282018,UPDATE 5-Trump threatens to cut GM subsidies in retaliation for U.S. job cuts ,WASHINGTON  Nov 27 U.S. President Donald Trump threatened on Tuesday to eliminate subsidies for General Motors Co in retaliation for the automaker cutting U.S. jobs and plants  and the automaker also took fire from Canadian political and labor leaders for cutbacks there.,normal
TSLA,11272018,Auto group says Tesla's China sales plunge; company's shares slide ,BEIJING/SHANGHAI Tesla Inc's  vehicle sales in China sank 70 percent last month from a year ago  the country's passenger car association told Reuters on Tuesday  underscoring how the Sino-U.S. trade war is hurting the U.S. electric carmaker.,topStory
TSLA,11272018,UPDATE 2-Auto group says Tesla's China sales plunge; company's shares slide ,* Steep tariffs on U.S. auto imports hurt Tesla China sales (New throughout  to add Tesla California spokesman comment),normal
TSLA,11272018,U.S. SEC chairman says Tesla case is 'settled' despite CEO's tweet , (The Nov. 26 story corrects paragraphs 4 and 5 to show the SEC filed charges against Musk and Tesla  and that Musk and Tesla settled those charges without admitting or denying the SEC's allegations),normal
TSLA,11272018,CORRECTED-U.S. SEC chairman says Tesla case is 'settled' despite CEO's tweet ,WASHINGTON  Nov 26 The U.S. Securities and Exchange Commission chairman said on Monday that the agency would not revisit its securities fraud settlement with Tesla Inc despite Chief Executive Elon Musk's tweet mocking the regulator.,normal
TSLA,11272018,REFILE-Tesla China sales drop sharply in October - auto industry body ,BEIJING/SHANGHAI  Nov 27 Tesla Inc sold just 211 cars in China last month  a sharp drop versus a year ago  the country's passenger car association told Reuters on Tuesday  underscoring how the Sino-U.S. trade war is hurting the electric carmaker.,normal
TSLA,11222018,Tesla cuts China car prices to absorb hit from trade war tariffs ,BEIJING/SHANGHAI Tesla Inc  is cutting the price of its Model X and Model S cars in China  the U.S. firm said on Thursday  in a shift in strategy that will see it take more of a hit from tariffs linked to a biting trade war between China and the United States. | Video ,topStory
TSLA,11222018,UPDATE 1-Tesla cuts China car prices to absorb hit from trade war tariffs ,* Tesla cuts Model X  Model S car prices in China by 12-26 percent,normal
TSLA,11192018,Musk hints at Tesla interest in Daimler van ,Tesla Inc  could be interested in partnering with Daimler AG's  Mercedes-Benz on an electric version of its Sprinter van  Chief Executive Officer Elon Musk said in a tweet https://twitter.com/elonmusk/status/1064541185820114944 on Monday.,topStory
TSLA,11192018,Musk hints at Tesla interest in Daimler van ,Nov 19 Tesla Inc could be interested in partnering with Daimler AG's Mercedes-Benz on an electric version of its Sprinter van  Chief Executive Officer Elon Musk said in a tweet https://twitter.com/elonmusk/status/1064541185820114944 on Monday.,normal
